{
  "attack_id": "post_chargeback_001",
  "bucket": "post_transaction_abuse",
  "subtype": "chargeback_fraud",
  "attack_name": "Chargeback fraud",
  "variant_name": "Repeated dispute after fulfilled purchases",
  "channel": "ecommerce",
  "rail": "card",
  "scope": "multi_step_campaign",
  "actor_type": "external_fraudster",
  "attacker_goal": "recover funds through misleading disputes after receiving goods or services",
  "genai_role": ["dispute_narrative_generation", "claim_refinement"],
  "preconditions": ["customer can file disputes after purchase completion"],
  "attack_sequence": [{"step": 1, "action": "complete purchase", "observable": "normal checkout"}, {"step": 2, "action": "file dispute later", "observable": "claim after fulfillment evidence"}],
  "expected_signals": ["high_dispute_frequency", "claim_after_delivery", "refund_to_purchase_ratio"],
  "data_fields_affected": ["transaction_type", "status", "amount", "customer_id"],
  "generation_strategy": {"mode": "template_plus_sampling", "stealth_level_range": [0.5, 0.85], "volume_range": [2, 20], "noise_level": "medium"},
  "severity": "medium"
}

