{
  "attack_id": "social_vendor_reroute_001",
  "bucket": "social_engineering_payment_fraud",
  "subtype": "vendor_rerouting",
  "attack_name": "Fake invoice or vendor rerouting",
  "variant_name": "Changed beneficiary on existing invoice",
  "channel": "email",
  "rail": "ach",
  "scope": "multi_step_campaign",
  "actor_type": "external_fraudster",
  "attacker_goal": "redirect a scheduled vendor payment",
  "genai_role": ["invoice_generation", "reply_chain_continuation"],
  "preconditions": ["vendor payment instructions can be updated by message"],
  "attack_sequence": [{"step": 1, "action": "submit updated payment instructions", "observable": "bank detail drift for known vendor"}],
  "expected_signals": ["beneficiary_change", "vendor_contact_mismatch", "invoice_metadata_mismatch"],
  "data_fields_affected": ["merchant_id", "transaction_type", "amount", "event_time"],
  "generation_strategy": {"mode": "hybrid", "stealth_level_range": [0.6, 0.95], "volume_range": [2, 10], "noise_level": "medium"},
  "severity": "critical"
}

